{
 "meta": {
  "version": "1.0.0",
  "course": "EN33207",
  "issued": "2026-10-27",
  "app": "ELF Studio",
  "dataStatus": "WS-D Module 2 data, merged 2026-10-26"
 },
 "settings": {
  "lessonMinutes": 50,
  "ratingScale": [
   {
    "value": 1,
    "label": "Not yet"
   },
   {
    "value": 2,
    "label": "Developing"
   },
   {
    "value": 3,
    "label": "Good"
   },
   {
    "value": 4,
    "label": "Excellent"
   }
  ],
  "pitchClock": {
   "pitch": 60,
   "rate": 60,
   "rotations": 4
  }
 },
 "groups": [
  {
   "id": 1,
   "profession": "business",
   "label": "Business",
   "size": 3
  },
  {
   "id": 2,
   "profession": "business",
   "label": "Business",
   "size": 3
  },
  {
   "id": 3,
   "profession": "medicine",
   "label": "Doctor",
   "size": 3
  },
  {
   "id": 4,
   "profession": "medicine",
   "label": "Doctor",
   "size": 3
  },
  {
   "id": 5,
   "profession": "dentistry",
   "label": "Dentist",
   "size": 3
  },
  {
   "id": 6,
   "profession": "veterinary",
   "label": "Veterinary science",
   "size": 3
  },
  {
   "id": 7,
   "profession": "engineering",
   "label": "Engineering",
   "size": 3
  },
  {
   "id": 8,
   "profession": "accounting",
   "label": "Accounting",
   "size": 3
  },
  {
   "id": 9,
   "profession": "design",
   "label": "Designer",
   "size": 3
  },
  {
   "id": 10,
   "profession": "humanities",
   "label": "Humanities",
   "size": 3
  }
 ],
 "professions": {
  "business": {
   "label": "Business",
   "mmiLabel": "Business & Management",
   "words": [
    "stakeholder",
    "profit margin",
    "cash flow",
    "target market",
    "corporate social responsibility (CSR)",
    "supply chain",
    "return on investment (ROI)",
    "scalability",
    "pivot",
    "SME",
    "weigh up the trade-offs",
    "long-term sustainability",
    "take ownership of",
    "a calculated risk",
    "be held accountable"
   ],
   "taboo": {}
  },
  "medicine": {
   "label": "Doctor",
   "mmiLabel": "Medicine (Doctor)",
   "words": [
    "triage",
    "informed consent",
    "confidentiality",
    "antimicrobial resistance (AMR)",
    "Universal Coverage Scheme",
    "palliative care",
    "comorbidity",
    "community hospital",
    "evidence-based medicine",
    "burnout",
    "weigh up the risks and benefits",
    "duty of care",
    "act in the patient's best interests",
    "escalate a concern",
    "acknowledge my limitations"
   ],
   "taboo": {}
  },
  "dentistry": {
   "label": "Dentist",
   "mmiLabel": "Dentistry",
   "words": [
    "dental caries",
    "periodontal disease",
    "fluoride varnish",
    "fissure sealant",
    "root canal treatment",
    "orthodontics",
    "enamel",
    "dental anxiety",
    "dental therapist",
    "overtreatment",
    "manual dexterity",
    "put someone at ease",
    "strike a balance between",
    "prevention is better than cure",
    "a conflict of interest"
   ],
   "taboo": {}
  },
  "veterinary": {
   "label": "Veterinary science",
   "mmiLabel": "Veterinary Science",
   "words": [
    "zoonosis (pl. zoonoses)",
    "rabies",
    "post-exposure prophylaxis (PEP)",
    "euthanasia",
    "neutering (sterilisation)",
    "biosecurity",
    "withdrawal period",
    "livestock",
    "exotic pet",
    "the Five Freedoms",
    "One Health",
    "quality of life",
    "compassion fatigue",
    "be torn between",
    "a duty to the public"
   ],
   "taboo": {}
  },
  "engineering": {
   "label": "Engineering",
   "mmiLabel": "Engineering",
   "words": [
    "structural integrity",
    "load-bearing",
    "safety factor",
    "feasibility study",
    "prototype",
    "specification",
    "drainage capacity",
    "particulate matter (PM2.5)",
    "renewable energy",
    "life-cycle cost",
    "mitigate the risk",
    "root cause",
    "fit for purpose",
    "compromise on safety",
    "unintended consequences"
   ],
   "taboo": {}
  },
  "accounting": {
   "label": "Accounting",
   "mmiLabel": "Accounting & Finance",
   "words": [
    "audit",
    "auditor independence",
    "financial statements",
    "revenue recognition",
    "internal controls",
    "materiality",
    "tax deduction",
    "VAT (value added tax)",
    "embezzlement",
    "liquidity",
    "professional scepticism",
    "a conflict of interest",
    "cut corners",
    "uphold integrity",
    "public trust"
   ],
   "taboo": {}
  },
  "design": {
   "label": "Designer",
   "mmiLabel": "Design",
   "words": [
    "design brief",
    "user-centred design",
    "prototype",
    "iteration",
    "accessibility",
    "intellectual property (IP)",
    "derivative work",
    "sustainability",
    "brand identity",
    "mood board",
    "strike a balance between",
    "creative integrity",
    "take something on board",
    "trade-off",
    "with the end user in mind"
   ],
   "taboo": {}
  },
  "humanities": {
   "label": "Humanities",
   "mmiLabel": "Humanities",
   "words": [
    "liberal arts",
    "primary source",
    "close reading",
    "interdisciplinary",
    "localisation",
    "cultural heritage",
    "repatriation",
    "rhetoric",
    "discourse",
    "source criticism",
    "transferable skills",
    "put something into context",
    "a nuanced view",
    "engage with multiple perspectives",
    "lost in translation"
   ],
   "taboo": {}
  }
 },
 "rooms": {
  "evidenceAudit": {
   "title": "Evidence Audit",
   "lesson": "L09",
   "intro": "List 8 experiences. For each one, say your own role, when, the scale (a number) and how someone else could check it.",
   "rows": 8,
   "fields": [
    {
     "key": "experience",
     "label": "Experience",
     "hint": "What did you do? Start with a verb.",
     "example": "Volunteered at a dog shelter"
    },
    {
     "key": "role",
     "label": "Role",
     "hint": "What was your own part? Not the team's.",
     "example": "Weekend volunteer: feeding, walking, adoption-day helper"
    },
    {
     "key": "when",
     "label": "When",
     "hint": "Dates or duration.",
     "example": "Every Saturday, Jan 2025 – Jun 2026"
    },
    {
     "key": "scale",
     "label": "Scale",
     "hint": "A number: people, hours, times, money, size.",
     "example": "35 dogs prepared for adoption; about 300 hours"
    },
    {
     "key": "evidenceType",
     "label": "Evidence type",
     "hint": "How could someone check it?",
     "example": ""
    },
    {
     "key": "link",
     "label": "Link or location",
     "hint": "Where is the proof? Paste a link or say where it is.",
     "example": "Drive folder 'Shelter' / certificate in my portfolio"
    }
   ],
   "evidenceTypes": [
    {
     "key": "certificate",
     "label": "Certificate",
     "description": "A certificate, award letter or official record with your name, the organiser and a date.",
     "example": "Thai Red Cross first-aid certificate, 16 hours, March 2026"
    },
    {
     "key": "link",
     "label": "Link",
     "description": "A public web page, video or post that shows the work and your part in it.",
     "example": "School Facebook post about the stall, with your name in the caption"
    },
    {
     "key": "photo",
     "label": "Photo",
     "description": "A dated photo of you doing the activity or of the result.",
     "example": "Photo of you at the shelter with the volunteer badge, July 2025"
    },
    {
     "key": "witness",
     "label": "Witness",
     "description": "A named adult who saw your work and will confirm it (teacher, supervisor, organiser).",
     "example": "Khun Somsri, shelter manager, phone and email on file"
    },
    {
     "key": "product",
     "label": "Product",
     "description": "Something you made that can be shown: a model, report, app, design, video or booklet.",
     "example": "The 15-page farm biosecurity report"
    },
    {
     "key": "none",
     "label": "None yet",
     "description": "No proof yet. The claim cannot be checked until you find or create evidence.",
     "example": "—"
    }
   ],
   "flags": {
    "unverifiable": {
     "label": "Unverifiable",
     "rule": "evidenceType is 'none', or evidenceType is 'link' and the link field is empty",
     "message": "Nobody can check this yet. Find a certificate, link, photo, witness or product, or leave this experience out."
    },
    "noScale": {
     "label": "No scale",
     "rule": "scale contains no digit",
     "message": "Add a number: people, hours, weeks, times, baht, or size."
    }
   },
   "frames": [
    "I have … since … (still doing it)",
    "I … in … (finished)",
    "My own part was …",
    "You can check this with …"
   ],
   "exportHeading": "Evidence audit: 8 experiences",
   "c1Extension": "Add a 'so what' to each row and rank the 8 by relevance to your target programme."
  },
  "lineUpgrader": {
   "title": "Line Upgrader",
   "lesson": "L10",
   "formula": [
    "Verb",
    "What",
    "Scale/Result",
    "So what"
   ],
   "intro": "Rewrite each weak line: start with a verb from the bank, add a number or a duration, and end with a result.",
   "verbGroups": [
    {
     "key": "lead",
     "label": "Lead and organise",
     "verbs": [
      "Led",
      "Organised",
      "Coordinated",
      "Chaired",
      "Managed",
      "Directed",
      "Founded",
      "Launched",
      "Captained",
      "Hosted"
     ]
    },
    {
     "key": "create",
     "label": "Create and build",
     "verbs": [
      "Designed",
      "Built",
      "Created",
      "Developed",
      "Wrote",
      "Produced",
      "Programmed",
      "Illustrated",
      "Composed",
      "Prototyped"
     ]
    },
    {
     "key": "improve",
     "label": "Improve and solve",
     "verbs": [
      "Improved",
      "Reduced",
      "Increased",
      "Raised",
      "Cut",
      "Fixed",
      "Streamlined",
      "Redesigned",
      "Solved",
      "Doubled"
     ]
    },
    {
     "key": "research",
     "label": "Research and analyse",
     "verbs": [
      "Researched",
      "Analysed",
      "Surveyed",
      "Measured",
      "Tested",